{
  "schema_version": 1,
  "mode": "live",
  "synthetic_provider_usage": false,
  "started_at": 1791605535.709252,
  "state_dir": "<isolated-state-directory>",
  "conditions": {
    "model": "deepseek-flash",
    "worker_reasoning": "high",
    "native_final_reasoning": "none",
    "verify": false,
    "title_sidecar": false,
    "tool_menu": "registry",
    "outer_prompt_template_sha256": "7f5d9ad9fb7752f57877262fb2ac0a7c33062dc0d7ab9d1a65af080ae89bc853",
    "unknown_tool_hints": "registered IDs only",
    "cold_kernel_each_run": true,
    "path_order": "counterbalanced by fixture/repetition",
    "repeats": 2,
    "fixtures": [
      "invoice",
      "ledger"
    ],
    "model_attempts_per_run": 6,
    "tool_starts_per_run": 8,
    "timeout_seconds_per_run": 120.0,
    "output_tokens_per_request": 2048,
    "request_bytes_limit": 60000
  },
  "envelope": {
    "runs": 8,
    "maximum_provider_requests": 48,
    "maximum_completion_tokens": 98304,
    "maximum_serialized_request_bytes": 2880000,
    "summed_run_deadlines_seconds": 960.0,
    "dollar_upper_bound": null,
    "note": "Request bytes are not token counts. No dollar cap is inferred without billing rates and a tokenizer."
  },
  "source_sha256": {
    "backend/app/__init__.py": "16d6fd7921933103f4e2bd2d10474f410232fc5743abea34d650df8ecc55b97c",
    "backend/app/agent/__init__.py": "97b5d595dc21056b7c7967c1023502312cdec0ae871c4dbd341d99169c3013ec",
    "backend/app/agent/activity.py": "6c6c2337c28de54a153b44fde43cc205a43a1e2cb0d333a5cb899eca87ebde3c",
    "backend/app/agent/budget.py": "ea2f3a7770f3de38297d9c6969c1ff2fb57e8e68f903cd5c852b1f7feac35202",
    "backend/app/agent/child_env.py": "18afc2fcd740d8a6af5e31fd2de8546384f13c20a58961182671aa55c1fa8e76",
    "backend/app/agent/datasets.py": "74925723cf379716888323a5270c8e4445a01339fe56a51fdc98ea00b65d5a6b",
    "backend/app/agent/document_ocr.py": "409a6b4f00f6bfc066b820bd5413220b06983118fc08e5711a448933e55473e9",
    "backend/app/agent/events.py": "9a287f639252afa7b2b2883d37a6c78838bba08ca2128f19ddc00be5fe782b09",
    "backend/app/agent/execution.py": "93da32bb83e3e407c8132cef9fd410394de8a9fa79b09bfd996686eec1436a15",
    "backend/app/agent/harness.py": "0891d7f744a3bd6fcf579405565228085650d39a63449bb68b52c33aa29f7c4c",
    "backend/app/agent/kernel.py": "e0e4c59cfc832041f9d50696f68e0aba1c92a9eab003f6b27f164626e4d6d7a3",
    "backend/app/agent/lambda_bridge.py": "22cb6b4ae4e475496693d4b9adc324f99055c7ba882619c1f7474bedef8ac988",
    "backend/app/agent/loop_policy.py": "9e756cec5362100ca8afdec873d4b36e9874ffe0743ce0faca0aa240763edeba",
    "backend/app/agent/mcp/__init__.py": "99fa3f604c7de64dd1d2f390ba4119132f6a759182f493cd1db6617b407d1e27",
    "backend/app/agent/mcp/__main__.py": "fa949e57982361ce966a653c2fc1f69022ebbe857ec0d8c85d30d70eacb0c498",
    "backend/app/agent/mcp/client.py": "5f61bf30a1169d99202f78bfdab9b766739a1e5fc636470b65453c9f2dd4b76b",
    "backend/app/agent/mcp/config.py": "cf9279796de0dd596059d6c049db926527559b47d119610dd21b0efc1b05543d",
    "backend/app/agent/mcp/results.py": "c26f4d548125e7ab4c7162f613a7169581c024dd923a7097ead0f6d9e045cde1",
    "backend/app/agent/mcp/sandbox.py": "6d08f81c234af9e087f04be6432e833dd63a08ba86dbfb4314805be2e4c946d7",
    "backend/app/agent/monitor.py": "99e65a34bb6576d5322fa253f1108f889b59353660994b56a1fe1aecb9b7ed31",
    "backend/app/agent/notebook.py": "6bfecec890a37c52b18cf01d09243cf831b09db72dba1c6dfa2ac34a45d62a67",
    "backend/app/agent/presentation.py": "8b4dac35ef7ab254048983f6cde55ab6a5474445b8b7ec990c5ada0372f46eec",
    "backend/app/agent/prompts.py": "5a9a5d9c6365a3c1c61b2f41f559502d84d91f9664a7d48737e8f6d7a934990f",
    "backend/app/agent/recovery_guard.py": "e318f4f5c3842e5b61c288eb31d00fa02b791d05b46b03ef9aa59e3765623aa7",
    "backend/app/agent/results.py": "d6fa89d6c601bb8221074cdbdf6f83641b2b1abbae86a6bef24caacf906b0ab6",
    "backend/app/agent/runs.py": "f132843245f69b36cdb1dfbe0eae38521d9785bff9e2e4910da52864ccb3ccad",
    "backend/app/agent/scheduler.py": "62f13cc2f6370692e27c994a258f413282480cc921bf0d860dfeda2e093a3473",
    "backend/app/agent/session/__init__.py": "c1c81d26fb2880946be833e17a04724a144afcb641bda8e74f8ed952d107242b",
    "backend/app/agent/session/derive.py": "d9a73fbebdb85c9e00dad1629440e52afefd143725cab31809ce5bc3f79aeaa1",
    "backend/app/agent/session/events.py": "c2bf76d8e117d1411e13884db8610c531f9fca98c9a8df2b8bb50253eecbf6b7",
    "backend/app/agent/session/log.py": "777749e7425943f01892c89c962daba94e055607c1c6554d356fe0036057c7f3",
    "backend/app/agent/session/repair.py": "d0ece1b7b2526eb7cf69030c7bfecfc43effc30ea41c33e24a85f283ea8ab65f",
    "backend/app/agent/session/store.py": "c4098acc6c0ac2573a962bb15ab86954a731ea65423f30a4b6baa43dfc1f0763",
    "backend/app/agent/session/stream.py": "1769408459381cfb75dd0e0147a899eed55c8782ba3988c531875b62014fbc38",
    "backend/app/agent/session/telemetry.py": "42c2950512face71fd91524da892a7a3bbf4afdbc63094b671ced39db40c5403",
    "backend/app/agent/session/validate.py": "907ebc2c95b706488ee87225cfef5ddf032f968f5e2027ce0872465cefb4016f",
    "backend/app/agent/skills/__init__.py": "607ee459573f3a964702753b26720d8e00f01ee4e13133d80e8f7cf622a63da9",
    "backend/app/agent/skills/loader.py": "47b07fce1ae5208298f51a530797d9eb50cd9d38c868ae398d3de68479784860",
    "backend/app/agent/skills/materialize.py": "800afcfa287811ce90f83219142f1cd2ffc11a82b2d04d14a25c50fb02affc55",
    "backend/app/agent/skills/router.py": "64ad51134cb926f5925932b0692ee0e0a5a67da769b2e1c2ecf20746862a4947",
    "backend/app/agent/skills/slash.py": "e7d6d7461856f4798a3fca47a92d5c9966ea01d0b63bbd369c4092544cd04085",
    "backend/app/agent/tools/__init__.py": "2b37397bff3e4642933214cded092c86d39274369baec2e4f8937dcd13a0ef42",
    "backend/app/agent/tools/base.py": "dda76d537af739b7835c74c7725bd49dfcc6018b295d3e14060fb3be57936bfa",
    "backend/app/agent/tools/discovery_tool.py": "52c8819dc23ecdae880b1dc507d811fbcd99863ec01d265af08119e56a8f1075",
    "backend/app/agent/tools/document_tool.py": "ee8a7cb0e83a4d6714ea3297d88f52c8611a523fc12922c200f2bdfa40296098",
    "backend/app/agent/tools/file_tools.py": "b483dd914bb1972df5cb5538c41e72082e418dba86e5a0c74005cb4b2fbe99b1",
    "backend/app/agent/tools/lambda_tool.py": "6b4cfdf1bfc00a288171563b16c20077fde1c0fdb82bdfd1b2a980381d86f2dd",
    "backend/app/agent/tools/math_tools.py": "11750c08dd0815e4233af6a637983eb1ac94b7cb77e2d43c251d1893f0b75f0b",
    "backend/app/agent/tools/plan_tool.py": "a77fa82d1afed9c711142112a830561b05e37d9bc2545917fe23ec36fefbed16",
    "backend/app/agent/tools/progress_tool.py": "d13b5c5f31739c330b74af20d23de2642a113a9d00d0347664af87e9955f5499",
    "backend/app/agent/tools/python_tool.py": "00fc9301127ad94d4ccd813294627556511f564203e2129b5a47db23f1f87962",
    "backend/app/agent/tools/read_state.py": "b62e732680204a1bcb27171083b920506f983832bf50403acff5dafdd0cd5730",
    "backend/app/agent/tools/result_tool.py": "1180fbfa90dc2263fbca1c8497b40a7d4040c372f12c506b6ffb527fb34b4685",
    "backend/app/agent/tools/router.py": "220b4a517478c4fce6febd4c1e99b4906e3268aad03d02b13d500b9637474180",
    "backend/app/agent/tools/shell_tool.py": "7e4eea8dcfe55e08dbe90c58e86791a434d7a21ae28a596b1a88c8fba1f111c2",
    "backend/app/agent/tools/skill_tools.py": "1ab28b482ffe68e3231c3e47f0ec28caf46770594cbb96b35f4aba7d8d7d1aa5",
    "backend/app/agent/tools/ui_tools.py": "354d8998886a457e8c92b62ca1c735de653e25cf2901a9fd4d0664a88486da23",
    "backend/app/agent/tools/web_search.py": "2bfab0db98e261860c73a9a85a341c5aa652ea2ec54673e1ca75e3d3286bda38",
    "backend/app/agent/workspace.py": "618b976f6a8f3dc65c615bbdf5d371ff0084995b6ca14d2cfb8d2b96d15b5cc0",
    "backend/app/api/__init__.py": "880491e1023c0a1e2ec4deb090b1be6983a3ebcb718b31c82d9c0e98c3596b4f",
    "backend/app/api/chat.py": "7e9bbee6a9ba5ab4f250f1bea6b3074727a9327dc0a4c0c76ce2145dd2326e3c",
    "backend/app/api/conversations.py": "04713b373ecdadadca2475609db79108edd6742a1fec4650ad6848f10ed2b7ed",
    "backend/app/api/files.py": "941fb6527b6518d18f0a02e36881e16f987997a0e0f9624260364cce169a19cb",
    "backend/app/api/followups.py": "8ad7039b789f2365605fe8c70753716b5a5dec19710fc2a8bfaeaeb7eacde619",
    "backend/app/api/providers.py": "2220dc7c2a8fe25188a6a474fb5d2e3d24a510eb444636b40a7f08b5e4453098",
    "backend/app/api/skills.py": "11a14420728de41dad18aa4459a8e05b5f30c51c26e8ea0662dbd6a1a4256992",
    "backend/app/api/suggestions.py": "8d4b39725875d8cb5cf3a8f4fe1cbdac1faca2cacede04130c50f8b4d2b50c0d",
    "backend/app/api/tools.py": "14bce88ef18bb21922559aa4e0158a7de5dea3e41fb206b057e72fbbcdac0e94",
    "backend/app/api/ui.py": "b07cc2e9abee870758f4694335034bc60d9a71d26e8d6eb7c584374f54c22f0c",
    "backend/app/config.py": "ca883020dfd81b5ba880b52c4ba2428bf7da1b8bcfc0e91edca3d89a5b10d367",
    "backend/app/data/__init__.py": "ae020f436dd56ba85cf12363f1c53986d30a9809fc075fec423dc57de483a051",
    "backend/app/data/lambda_host.py": "1d3e392c5a3af58531796354dabbb109175efdea75d867a7bd39bc55dd012c61",
    "backend/app/llm/__init__.py": "b7db0f0a3bf7088e38ec103292a879c9bd0389c03332792ab54a45ae42e09ede",
    "backend/app/llm/base.py": "d2f721079979eb9d3619cf98b6f5276ac1d10a928db427a732789460c9e51c0f",
    "backend/app/llm/catalog.py": "f5a743c278c8cad555d5d7b138f5cb9874a5fc9260df591281fb3ba7602ca874",
    "backend/app/llm/openai_compat.py": "8c2427f25ae11e642900f3d6434b32ade8a24688e71347bd5bfe8b714542cc99",
    "backend/app/llm/registry.py": "037520f4c7806039123f579671ebcf0f112b34cffc19a20a5c8228bb86c6277a",
    "backend/app/main.py": "9a414689e32add27310df00012fccd952eabf570f9cdcb99acf9b866afe66754",
    "backend/app/runtime.py": "69d7db54ffa8f045e91e9e6ed36b644ad94f104fb685cd8e7630475e0c864dee",
    "backend/app/storage/__init__.py": "b151453478a8623bf3fa004c0b799b866bcb8f3e9b715280dc8d942ddf36faf0",
    "backend/app/storage/db.py": "a792108bcbb8c6e1ed0de7526426e2d15fd2af89b1c7cc1a942aef2cbeb9611a",